{
  "schema_version": "1.0",
  "base_prefix": "/usr",
  "platform": "linux-x86_64",
  "language": {
    "version": "3.14",
    "version_info": {
      "major": 3,
      "minor": 14,
      "micro": 0,
      "releaselevel": "alpha",
      "serial": 0
    }
  },
  "implementation": {
    "name": "cpython",
    "version": {
      "major": 3,
      "minor": 14,
      "micro": 0,
      "releaselevel": "alpha",
      "serial": 0
    },
    "hexversion": 51249312,
    "cache_tag": "cpython-314",
    "_multiarch": "x86_64-linux-gnu"
  },
  "interpreter": {
    "path": "/usr/bin/python"
  },
  "abi": {
    "flags": ["t", "d"],
    "extension_suffix": ".cpython-314-x86_64-linux-gnu.so",
    "stable_abi_suffix": ".abi3.so"
  },
  "suffixes": {
    "source": [".py"],
    "bytecode": [".pyc"],
    "optimized_bytecode": [".pyc"],
    "debug_bytecode": [".pyc"],
    "extensions": [".cpython-314-x86_64-linux-gnu.so", ".abi3.so", ".so"]
  },
  "libpython": {
    "dynamic": "/usr/lib/libpython3.14.so.1.0",
    "dynamic_stableabi": "/usr/lib/libpython3.so",
    "static": "/usr/lib/python3.14/config-3.14-x86_64-linux-gnu/libpython3.14.a",
    "link_to_libpython": true
  },
  "c_api": {
    "headers": "/usr/include/python3.14",
    "pkgconfig_path": "/usr/lib/pkgconfig"
  }
}
